{
  "type": "object",
  "$schema": "http://json-schema.org/draft-04/schema#",
  "description": "Inventory event body",
  "properties": {
    "eventId": {
      "description": "Event id",
      "type": "string"
    },
    "type": {
      "description": "Event type",
      "$ref": "inventoryEventType.json"
    },
    "tenant": {
      "description": "Tenant id",
      "type": "string"
    },
    "eventTs": {
      "description": "Event timestamp",
      "type": "integer",
      "format": "int64"
    },
    "new": {
      "description": "Record new fields",
      "type": "object"
    },
    "old": {
      "description": "Record old fields",
      "type": "object"
    }
  }
}
